{
  "architecture": {
    "name": "analytic_fixed_common_pooled_linear",
    "version": "E2_pilot_v1"
  },
  "augmentation": {
    "location": "none",
    "name": "none"
  },
  "checkpoint_criterion": "maximum tuning-validation 44-class macro-F1; earliest tie",
  "data": {
    "evaluation_split": "validation",
    "manifest": "research/e0_e3_20260915/dataset_manifest.json",
    "manifest_checksum": "f874abc5949d1f850dee5137eee4b6e64721c9740d9d80866e27d8d8b11208cd",
    "protocol_checksum": "9a39c04163485ea18eda62b10be4b4d27f23ee07facdce7323f37b446ea848d0",
    "test_ids": [
      "pixel-sha256:00b17e6a5c9586ddafdd3fc3679b1da02fbee564d5de4def0f48f9196b88e327",
      "pixel-sha256:0104eade1299092a97ac940e02d39fdebcf39a9d8cf4e72b3cc8501e3c37e154",
      "pixel-sha256:03339c2e6e66a40f35905fc0f81e442e154ec69ec791089e8f859e96ff0f176e",
      "pixel-sha256:03e27fab6aa71f1984881bf403549371b948b504b21255799fe72d1325c0a69e",
      "pixel-sha256:04a0fbd553d976384fc84deabc625c82eee1f2abd70fe318be184b9dd646547b",
      "pixel-sha256:051c63fed4593e71b22bdcd92d354a75c92af08c6c25fa04e79fec95bb044d17",
      "pixel-sha256:05be7ec8647a471fc95a24a5b998a6c9ad873586b0dd4b9ff39a0f8c61176e10",
      "pixel-sha256:05e245a06fc53a6a8b21b3e092ca16fc07f8a1e864fd35a5f33fb92d75b6a426",
      "pixel-sha256:060c134b61bbd11d5575c57c78551d65b7ef6d6f518d0aa077a29ddbe489e90e",
      "pixel-sha256:06121c291e4dfea0c107df55820d38236d9cfb5f5107e9817b7c132246e036ab",
      "pixel-sha256:07aa73c020202cafe95c6392fc810c6fe8307e0f6f175b1649a9ae988b5cb7af",
      "pixel-sha256:07d722c71bf5b376ed79df92014ef6029086c1686e0da5bfe3ae11a9c7a23345",
      "pixel-sha256:07e12067234c3b154d775f2322dce7b96952aa53c48c22b51278491835844df3",
      "pixel-sha256:07e7861121c89924af2ffd70db98ea4541838536e8bce1857ae6288ea6c33bde",
      "pixel-sha256:0949f21971c755fc17d6079a2a782fcb180ca1be18fbbc78d2fba91ab9b65070",
      "pixel-sha256:097cb3b3f103884f40647754dd731a3d39172ba6eefd8bd34a26240fe6d1678d",
      "pixel-sha256:09d0b1544b59f862488e5919216efcbb0af2db8d6fbb6f9cd5fbbc91e8bc6f2f",
      "pixel-sha256:0ad5d3b777f4560631b643e42a682b985df426880216b8107d48f77b53150a44",
      "pixel-sha256:0ade99353b091529ffb39c4585c0abcbda2f67f662f821478272243ba6c7356e",
      "pixel-sha256:0b319d9edc1cf696a478a190642ece2dd6bc36cafc4036d79209b0af212bc5fd",
      "pixel-sha256:0bb616de2ce06e04e9abfba4e8b61d0e885f4b5b07276c0009aa726996852343",
      "pixel-sha256:0d304a29a5f326f9d4ffb44e7d1ace2fd6b80769b07d5ca3bed8672659575d2d",
      "pixel-sha256:0df3811b7a58d8c06fa2084a0dca06c61df1a4f02d8427266a522c7bde42eb7e",
      "pixel-sha256:0fe0505a8e3ae638af81b6ad08ee5e84be487b3c3840ae82f3057b6f330ad614",
      "pixel-sha256:1039ca6e8700484d4d9d81b7ba16ef4dbaba65cb829b274a96cc29358b03a3c8",
      "pixel-sha256:10788c3dbe23b4e4e0a07f446b7217642ef7ef9206ff3387210c553ba6e51df3",
      "pixel-sha256:1105df9be13066365a3a5567bf4632b55d9ffa0eca6dbb0b97d60927078ca64a",
      "pixel-sha256:1161b70cfb4f69e4d80404f5fdc3f93d3004c1e668fa3f42a8bcefefd262544d",
      "pixel-sha256:11906ea5ef8cebee011c1a752cd9f572ffae8b46f515b52220102881ea762e51",
      "pixel-sha256:11923de651d9f3e775bd55df788e2b0ea9ccf9a5a9649cb512ad8cdbef6c971e",
      "pixel-sha256:1195c2d38e89641bda9c3b75da689f8a33b64cbbe0c5cbe14d1c00f590f9bdae",
      "pixel-sha256:1407d9dbe606853d1a678966a206abd66cf68fb270d16d86b875b2520d8ac1e0",
      "pixel-sha256:179af1c15945b0e560defdc7a00b6d85f3cdfd3f61560dccbda6fe8e7183aa11",
      "pixel-sha256:184dbcf1e5393d5fcf8bb5cebb387adfc79c6315faa9b3d883f388f544b8a757",
      "pixel-sha256:1861d5c341f08c3a7bb3603ea92141993187a477397f1f3e2a62fd6a7acb4fed",
      "pixel-sha256:18b6fde6a1675ff29c0d7633c3638eafb83189515c824ab390227015ba945e93",
      "pixel-sha256:18ffba454d7f6c1ad68681428d058ef60ceaf1d1de1763d087fecf1d2752fa90",
      "pixel-sha256:1909e6ee2c06c690902d35946d89f8efb1253b57af67172856a3d8fe93488ed2",
      "pixel-sha256:196208c9fac69ab415ff5c3739c5ea8e0a10fa44f64173ef0a2fc7263ddb4a3b",
      "pixel-sha256:19824b26fc87cde0974bb9e6274ad3cfc7b708e882a0cf473bae4996af685b85",
      "pixel-sha256:198d97090df41728e179aeaa18108d7d4d24da9da4b2f8f5aa5f8853521ef245",
      "pixel-sha256:199f04a1cdbffa02fc81e60ca80bbda75eb0e675af96b90354baf83fe900a383",
      "pixel-sha256:1a21d00096c05982da003dc7971bc6697c245ae8ca92b649401b0645d2444030",
      "pixel-sha256:1a5d4c7d842d3ce79dce9af447b0fa26f1227c058baf65596734c06cba084c4c",
      "pixel-sha256:1b334fdf9161bd7401c7b706d1d304f2373b0c4420c702295717ec0a7b3a69e9",
      "pixel-sha256:1b70e9eacca9de55d16bd0d6a110f418397cd876539e4fe5d99f608f94e66492",
      "pixel-sha256:1ca1e93a962f0c19eb2ca66a370a7053f0df9516a51a4a9d85c9381e109c0f00",
      "pixel-sha256:1ccb711d853473a0d4cb18d472b494490a8b9e024d232dfe7d8858c4bea83561",
      "pixel-sha256:1d17f438277328a20ae4824785750643185576f51678e7df5b1f13d1a7063061",
      "pixel-sha256:1d94a679fe3c145a9368660ad7fda69240530953abaf315464881ba7cdfa968e",
      "pixel-sha256:1db3483888da517b23e1d551d8a2f2fa7fb43e9f664d914dba9cead0b4309a3e",
      "pixel-sha256:1dc5fe4342309d1e86e106fcd9cf91ae563081afe35e1dd01aeb9f4462bdf1de",
      "pixel-sha256:1ed51028a052a82fed9efa93ea73717364444f2e0eadb9e07c650cdd18f3c1b0",
      "pixel-sha256:2018116cacbb3c93d13b69a0bf981aff95453db15c478b9d2c42e9fe2a6d0fff",
      "pixel-sha256:20a583255be0865e8b4cfaaf97dd2a179ee621a325d4115bab676350094f1912",
      "pixel-sha256:20b61d766b3ac9d4a64bb96cde3467c3b4eeadfd1af5ad08d4f327fa3a02b625",
      "pixel-sha256:21fda7a6c56356bb8b30c8e9441440e4d0707f601b8d401b3ebd364d983e9f76",
      "pixel-sha256:22c67b5f98dd6336b11308efc289a7f3bfa21cfe39c02dd4829e58108029c48d",
      "pixel-sha256:2355d045161d9ac32418156028bc021043fea36f15440593a6ae0eeab4a9c6db",
      "pixel-sha256:238bd1eb2781b68eed58cacd7afdd4d3e958c280247ea7f1809e0e882333203c",
      "pixel-sha256:24e17e56910f0d0d3fa34955a26a29bca2b86df3370d9dcccde7120181bb9b72",
      "pixel-sha256:24e1c3921743ffeec044a714f75bbef499eb0cc9798e8e55b130e4a4290358e1",
      "pixel-sha256:268a8dae9605f389199811ca53ed34219bfbca9c08eac3313e9f54a864874b6a",
      "pixel-sha256:2732ccb68dacda741541fb0a72639e35c18221793dcf5be3d0cb1f0d66872b50",
      "pixel-sha256:27c317a6f4ec385039d301e5bafeba0d205148069e6958f0faa49c5248eadcc1",
      "pixel-sha256:2847742191c6cf5fe2702229010879f66b534c93257caa6d9ec00648fcc0f2b7",
      "pixel-sha256:28811bce91fd68b79fa389266edc7228b7c6f4b34e322334cef63324e35f38d0",
      "pixel-sha256:28d7c4c9983a1dd2fc7b0fb9d4f7d9cbb84f38d0a4c6a8640925eebe902120cc",
      "pixel-sha256:28d99e8bcdb849523a91ab0e67b2902f5428c8729aaf5d5924983be39d9a1574",
      "pixel-sha256:2a6e650b11f904c63121e06a9f6a16187babf31d53e7978b49733c13072c0c33",
      "pixel-sha256:2aa3f3cab831e128c3294e666108204ae17fc24b436c920ac632e362a0fd80bd",
      "pixel-sha256:2c475ad8c5345334f820969f4323787280ca5cf5cb2f9cea8ed7961ea8dd2a2b",
      "pixel-sha256:2c5a21fe43a50dac67307ef66e0e2501a861a38a8b2f331c5124339afb1fbc1c",
      "pixel-sha256:2c71fdb36a5a0f33154fc538d6efafa297f682b6e1c1648a0956e260f2b6039f",
      "pixel-sha256:2d112aeda0c8bce5a94371203785350fcdb172b2f43524021b5d036f5c799317",
      "pixel-sha256:2d293a606920b0535496ab2695c9435feec1c532f384ae797d1a8a9b7e98aa5a",
      "pixel-sha256:2d463b882d3f931225ab46ec8bf1cd927e4c5a89d59958771b40ee34c3e2e385",
      "pixel-sha256:2d64de27da79f5df2ac373219f066b550bfa7154c8a93f9f634e9cb9e1bcb038",
      "pixel-sha256:2d9f6cd11fd5a6412c0afca56dbad20effc019345a0893fe3d27c68a9016f208",
      "pixel-sha256:2db7ca0743db936ef860b99400c527769ab629e89cb0316239fb16815880bee2",
      "pixel-sha256:2e2e06cab8da15a501b91c47fcde8b829f5961b5f1b9be4f2a0570d91a687400",
      "pixel-sha256:2f2c0deb4a4ff21b9f39e4d61e7fee244ecc7b4ed6a7aca211bd2175785e78de",
      "pixel-sha256:2fc266c538c6c8fec1b1d003761e4557d1418a74de88dad87a1c210665fc8d9e",
      "pixel-sha256:304c7c3662cc99de2e200df7b0fb6c90b22c6d4ae4e82841a4a2ea3bdb3ffc4e",
      "pixel-sha256:312e55c4fb2b715401ea34408a7aaf22f3f1ce845ade0e8c943a1517d0be3241",
      "pixel-sha256:313111e23cfdcd48dd551d280b4d25182147ec988bfea76449b9770f94eaa816",
      "pixel-sha256:32e078407490a1c35d8176638f06ae1c2233fa7c09de40611e47a8cc70b3eb90",
      "pixel-sha256:332ea79099b7431ebb59ba8370fec8f17c55ab6d87446878e5f2867228e833bb",
      "pixel-sha256:332f1121697874ba9155bf0725831d1fb35df299e96ef2b1f7d57ae92322f2f7",
      "pixel-sha256:336ae46a56d521ebb3128df31b15bbae8800389b37fabf587a520314ec3da3e7",
      "pixel-sha256:33b879f607e279397d2c432e6933ab3de8b106878d1552fca044e3f56dd97a97",
      "pixel-sha256:340d36343bfd1dda8fa193825294d355b6c78ea8902d910d4378ee68c028d702",
      "pixel-sha256:34991e372b7cb41fe076bda3b4751d640cef97be6e6aba16e879743995b1fe46",
      "pixel-sha256:3501d8c44a4a21c21442d87b6ac9156722e27b69a7106e6cd7ca6e280171fe52",
      "pixel-sha256:35ff4772fb2d6eebea94dc75880c98089f12e4ddb1cacfac45793da3215753ac",
      "pixel-sha256:367c5eb2b274d8e2e0181aabc1a3cbfc03ea3e6c9ad1e6b11c840398a04e3b39",
      "pixel-sha256:370e2ddf45a793a3a9cdce3565bab053561e61c5c830d8bf1a5ce2dbd55f182a",
      "pixel-sha256:37225b8eec567ed023cbbe160f3574b35fc86685baf4d6bf7c777e104a6b006e",
      "pixel-sha256:37369f5e41a12282e9d3cc7aa4eff2836e65b62979c2bdeece032f6f5aaa6997",
      "pixel-sha256:38d07b0dac2fe29c3ef823ff4302598550517ddb5835da3e6df56b005d045fcc",
      "pixel-sha256:398c97b8e79b44c0210fd04530183f94ac90177b2e3a80a4f44ab132bc40261a",
      "pixel-sha256:3ae43481efeb3f49856c25a0b409196de720a7965db440854d522273e2a3237a",
      "pixel-sha256:3bcd60c866a97d78afa24bd0cc0e5bf4d04881a188b68ce452bfad5d37438bce",
      "pixel-sha256:3de3dbc24dd0ca3c7f90d46428382c22c96533a72b9c64f3cff26a0b062b7579",
      "pixel-sha256:3fbc1d54f43d19babd27afd09dfcab78fa98377575c0e7f85fa39867206baf3d",
      "pixel-sha256:3ff503d473bcc1ad4c666d3a64adcde3020aea3e5eb32757bccbe1d29fd6ceda",
      "pixel-sha256:4014a2fff76e9e8635f53cf39bc835a93d98074f8a11f6605965a5b00d50fc7b",
      "pixel-sha256:41889b45ef362e974a870e3e71d4ef022a8d9636a53bf1ea13ff806cd10d0da5",